{
  "seller_company": "코봇시스템",
  "buyer_company": "알펜모빌 AG",
  "rounds": 2,
  "buyer_state": {
    "BB1_purpose_fit": {
      "status": "confirmed",
      "verdict": "fit",
      "evidence": "당사의 아웃도어 프리미엄 라인업 적용 목적에 맞춰 환경별 성능 검증 자료를 제공하기로 약속함"
    },
    "BB2_value_hierarchy": {
      "status": "confirmed",
      "verdict": "fit",
      "seller_asset_position": "mission",
      "evidence": "당사의 1순위 구매 이유인 '프리미엄 라인 차별화'에 정확히 부합하는 타사 대비 40% 안정성 우위를 강조함"
    },
    "BB3_substitute": {
      "status": "confirmed",
      "verdict": "fit",
      "substitute_types": [
        "competitor"
      ],
      "evidence": "자체 개발 시 2년 이상 소요 및 특허 회피 불가 상황에서, 타사 대비 40% 이상의 안정성 우위를 제공하여 외부 도입 명분이 확실함"
    },
    "BB4_opportunity_cost": {
      "status": "confirmed",
      "verdict": "fit",
      "evidence": "도입 초기 리스크 최소화를 위해 소량 PoC 진행을 제안하였으며, 실패 가능성에 대한 투명한 공유를 요청하여 리스크를 통제 중임"
    },
    "BB5_evidence": {
      "status": "confirmed",
      "verdict": "fit",
      "evidence": "안정성 우위 주장을 실증할 수 있는 실제 아웃도어 비교 테스트 영상과 데이터 팩 제공을 약속함"
    },
    "BB6_execution_gate": {
      "status": "confirmed",
      "verdict": "fit",
      "dealbreaker": false,
      "evidence": "유럽 시장 진출을 위한 필수 요건인 CE 인증 관련 분석 데이터 제공을 확약함"
    },
    "BB7_timing": {
      "status": "confirmed",
      "verdict": "fit",
      "evidence": "다음 분기 부품 아키텍처 확정을 앞두고 있어 현재가 도입 검토 및 PoC 진행의 최적기임"
    },
    "BB8_trust": {
      "status": "confirmed",
      "verdict": "fit",
      "authenticity_gate": "passed",
      "exploitation_detected": false,
      "evidence": "CES 2025 실물 확인으로 진위가 입증되었으며, 잠재적 이슈에 대한 투명한 공유를 요청하여 정직성을 테스트 중임"
    },
    "BB9_decision_structure": {
      "status": "confirmed",
      "verdict": "fit",
      "evidence": "CTO로서 실질적 결정권을 보유하고 있으며, 내부 승인 절차를 위한 데이터 팩과 영상을 선제적으로 제안받음"
    },
    "BB10_contract_protection": {
      "status": "unknown",
      "verdict": "na",
      "evidence": "아직 구체적인 계약 조건(IP, NDA, 독점 등)에 대한 논의가 진행되지 않음"
    }
  },
  "buyer_decision": {
    "decision": "conditional",
    "rationale": "미라클휠의 기술은 당사 차기 프리미엄 라인의 차별화 목적에 완벽히 부합하며, 아키텍처 확정 시기상 지금이 도입 적기입니다. 다만, 실제 플랫폼 결합 시의 리스크 관리와 유럽 시장 진출을 위한 인증 요건 검증이 선행되어야 합니다.",
    "conditions": [
      {
        "condition": "CE MDR 분석 데이터 및 아웃도어 성능 검증 자료 수령",
        "check_method": "내부 엔지니어링 및 컴플라이언스 팀의 자료 리뷰 통과"
      },
      {
        "condition": "플랫폼 결합 시 잠재적 이슈 및 실패 가능성에 대한 투명한 기술 문서 제공",
        "check_method": "제공된 리스크 분석의 구체성과 현실성을 내부 기술진이 평가"
      },
      {
        "condition": "소량 PoC 진행 합의",
        "check_method": "PoC 범위, 일정 및 비용에 대한 합의서 작성"
      }
    ],
    "risks": [
      {
        "type": "precondition",
        "desc": "제공된 CE 인증 데이터가 당사의 특정 아웃도어 환경 요구사항을 완전히 커버하지 못할 위험"
      },
      {
        "type": "profitability",
        "desc": "사전에 식별되지 않은 플랫폼 결합 이슈로 인해 PoC 단계에서 예상치 못한 개발 비용 및 시간 지연 발생 가능성"
      }
    ]
  },
  "seller_state": {
    "SB1_pitch_alignment": {
      "status": "assumed",
      "buyer_real_reason": "기존 프리미엄 라인의 정체된 성능을 극복하고, 타사 대비 압도적인 아웃도어 주행 안정성 및 독보적 고객 경험 확보",
      "misread_type": "direction"
    },
    "SB2_value_positioning": {
      "status": "assumed",
      "position": "core"
    },
    "SB3_evidence_packaging": {
      "status": "confirmed",
      "note": "단순 기술 사양을 넘어 아웃도어 주행 안정성과 고객 경험 측면의 차별적 가치를 입증할 증거 패키징 필요",
      "evidence_offered": [
        "CE MDR 분석 데이터",
        "아웃도어 환경별 성능 검증 자료",
        "일본 시장 적용 사례",
        "비교 테스트 영상과 데이터 팩"
      ]
    },
    "SB4_substitute_defense": {
      "status": "assumed",
      "substitute_type": "competitor",
      "note": "타사 제품 및 기존 자사 프리미엄 라인(status_quo) 대비 당사 모듈의 대체불가한 주행 안정성 논거 제시 요구됨"
    },
    "SB5_threshold_design": {
      "status": "confirmed",
      "downside_removers": [
        "소량의 PoC"
      ]
    },
    "SB6_execution_honesty": {
      "status": "assumed",
      "limits_disclosed": [
        "플랫폼 결합 시 발생 가능한 잠재적 이슈 및 실패 가능성 (구매자 요청)"
      ]
    },
    "SB7_authenticity_structure": {
      "status": "unknown"
    },
    "SB8_champion_arming": {
      "status": "confirmed",
      "champion_mode": true,
      "note": "내부 의사결정 승인을 위한 비교 테스트 영상 및 데이터 팩 제공 합의 완료"
    },
    "SB9_protection_screening": {
      "status": "assumed",
      "screening": "clean"
    },
    "SB10_strategic_relationship": {
      "status": "unknown",
      "stance": "pursue"
    }
  },
  "seller_outcome": {
    "outcome": "poc_agreed",
    "rationale": "구매자가 내부 의사결정을 위해 판매자가 제안한 데이터 팩과 영상을 수용하였으며, 리스크 최소화를 위한 소량 PoC 진행 의사를 명확히 밝혔습니다. 또한 플랫폼 결합 시 잠재적 한계와 이슈에 대한 투명한 공개를 요청하여, 실행 정직성(SB6)을 통한 신뢰 구축 단계로 진입했습니다."
  },
  "hypotheses": [
    {
      "frame": "explore",
      "lens": "buy",
      "statement": "상대방이 자사 제품의 한계나 잠재적 결합 이슈를 투명하게 공개한다면, 이는 장기적 파트너십을 위한 구조적 진정성(신뢰)의 강력한 신호가 될 것이다.",
      "dimension": "BB8_trust",
      "evidence_needed": "요청한 '잠재적 이슈나 실패 가능성'에 대한 답변의 구체성과 솔직함(한계 인정 여부) 평가"
    },
    {
      "frame": "explore",
      "lens": "sell",
      "statement": "구매자가 요구한 플랫폼 결합 시 잠재적 이슈를 선제적이고 투명하게 공개하면, 기술적 신뢰도가 상승하여 PoC 조건이 신속하게 확정될 것이다.",
      "dimension": "SB6_execution_honesty",
      "evidence_needed": "잠재적 한계 공개 후 구매자의 긍정적 피드백 및 구체적인 PoC 일정/조건 제시 여부"
    },
    {
      "frame": "exploit",
      "lens": "sell",
      "statement": "제공된 비교 테스트 영상과 데이터 팩이 내부 의사결정권자를 효과적으로 설득하는 챔피언 무장 도구로 작용할 것이다.",
      "dimension": "SB8_champion_arming"
    }
  ],
  "provenance": {
    "buyer_side": "simulated",
    "seller_side": "simulated",
    "outcome_anchor": false
  }
}