{
  "seller_company": "키뮤스튜디오",
  "buyer_company": "트렌디코 어패럴",
  "rounds": 2,
  "buyer_state": {
    "BB1_purpose_fit": {
      "status": "confirmed",
      "verdict": "unfit",
      "evidence": "판매자가 저작권 보호를 이유로 당사 내부의 직접 수정을 명시적으로 제한하여, 디자인 무단 참고 및 변형이라는 당사의 숨은 목적 달성이 어려워짐."
    },
    "BB2_value_hierarchy": {
      "status": "confirmed",
      "verdict": "caution",
      "evidence": "판매자는 발달장애 디자이너의 독창성(사회적 가치)을 강조하나, 당사의 1순위는 비용 지불 없는 트렌디한 디자인 확보임.",
      "seller_asset_position": "mission"
    },
    "BB3_substitute": {
      "status": "confirmed",
      "verdict": "caution",
      "evidence": "제공받은 시안을 당사 내부 디자인팀이 자체적으로 재해석(카피)하여 대체할 수 있음.",
      "substitute_types": [
        "in_house_capability",
        "make_vs_buy"
      ]
    },
    "BB4_opportunity_cost": {
      "status": "unknown",
      "verdict": "na",
      "evidence": "해당 없음"
    },
    "BB5_evidence": {
      "status": "confirmed",
      "verdict": "fit",
      "evidence": "삼성전자, 페레로로쉐와의 협업 비주얼 사례집 공유를 약속하여 검증 경로가 제시됨."
    },
    "BB6_execution_gate": {
      "status": "confirmed",
      "verdict": "unfit",
      "dealbreaker": true,
      "evidence": "당사의 핵심 프로세스인 내부 디자인팀의 즉각적인 자체 수정 및 재생산이 판매자의 저작권 정책으로 원천 차단되어 실무적 협업이 불가능함."
    },
    "BB7_timing": {
      "status": "unknown",
      "verdict": "na",
      "evidence": "해당 없음"
    },
    "BB8_trust": {
      "status": "confirmed",
      "verdict": "fit",
      "authenticity_gate": "passed",
      "exploitation_detected": false,
      "evidence": "대기업 협업 사례집 제공을 약속하여 판매자의 실재성이 확인됨."
    },
    "BB9_decision_structure": {
      "status": "unknown",
      "verdict": "na",
      "evidence": "해당 없음"
    },
    "BB10_contract_protection": {
      "status": "confirmed",
      "verdict": "unfit",
      "evidence": "판매자가 작가의 고유 창작물에 대한 저작권 보호를 강경하게 내세우며 내부 수정 제한을 명시하여, 라이선스 회피 및 무단 사용 관행에 직접적인 제동이 걸림."
    }
  },
  "buyer_decision": {
    "decision": "terminate_structural",
    "rationale": "당사의 핵심 프로세스인 내부 디자인팀의 즉각적인 디자인 재해석 및 변형(카피)이 판매자의 엄격한 저작권 보호 정책으로 인해 원천 차단되었습니다. 라이선스 비용 없이 트렌디한 디자인을 확보하려는 당사의 목적과 정면으로 충돌하며, 실무 운영 구조상 타협점이 없어 협상을 종료합니다.",
    "conditions": [],
    "risks": [
      {
        "type": "precondition",
        "desc": "판매자의 저작권 보호 정책 및 모니터링으로 인해 당사의 무단 참고 및 변형 관행이 법적 분쟁 리스크로 이어질 가능성이 높음."
      },
      {
        "type": "precondition",
        "desc": "[JDG-03 차원불일치] 목적 정합(BB1_purpose_fit)=unfit — 타 차원 fit 과 불일치, 확인 필요. 근거: 판매자가 저작권 보호를 이유로 당사 내부의 직접 수정을 명시적으로 제한하여, 디자인 무단 참고 및 변형이라는 당사의 숨은 목적 달성이 어려워짐."
      },
      {
        "type": "precondition",
        "desc": "[JDG-03 차원불일치] 가치 서열(BB2_value_hierarchy)=caution — 타 차원 fit 과 불일치, 확인 필요. 근거: 판매자는 발달장애 디자이너의 독창성(사회적 가치)을 강조하나, 당사의 1순위는 비용 지불 없는 트렌디한 디자인 확보임."
      },
      {
        "type": "precondition",
        "desc": "[JDG-03 차원불일치] 대체재 우위(BB3_substitute)=caution — 타 차원 fit 과 불일치, 확인 필요. 근거: 제공받은 시안을 당사 내부 디자인팀이 자체적으로 재해석(카피)하여 대체할 수 있음."
      },
      {
        "type": "precondition",
        "desc": "[JDG-03 차원불일치] 실행·선결 게이트(BB6_execution_gate)=unfit — 타 차원 fit 과 불일치, 확인 필요. 근거: 당사의 핵심 프로세스인 내부 디자인팀의 즉각적인 자체 수정 및 재생산이 판매자의 저작권 정책으로 원천 차단되어 실무적 협업이 불가능함."
      },
      {
        "type": "precondition",
        "desc": "[JDG-03 차원불일치] 계약·정보 보호(BB10_contract_protection)=unfit — 타 차원 fit 과 불일치, 확인 필요. 근거: 판매자가 작가의 고유 창작물에 대한 저작권 보호를 강경하게 내세우며 내부 수정 제한을 명시하여, 라이선스 회피 및 무단 사용 관행에 직접적인 제동이 걸림."
      }
    ]
  },
  "seller_state": {
    "SB1_pitch_alignment": {
      "status": "confirmed",
      "buyer_real_reason": "빠른 시즌 대응을 위해 내부 디자인팀이 원본 아트웍을 직접 수정 및 변형할 수 있는 실무적 유연성과 권한 확보",
      "misread_type": "direction"
    },
    "SB2_value_positioning": {
      "status": "assumed",
      "position": "unknown",
      "note": "[정규화: position='hidden'→'unknown']"
    },
    "SB3_evidence_packaging": {
      "status": "confirmed",
      "evidence_offered": [
        "삼성전자 및 페레로로쉐 협업 비주얼 사례집"
      ]
    },
    "SB4_substitute_defense": {
      "status": "confirmed",
      "substitute_type": "in_house"
    },
    "SB5_threshold_design": {
      "status": "confirmed",
      "downside_removers": [
        "전문 프로 디자이너의 즉각적인 편집 서비스",
        "15분 정도 짧은 미팅"
      ]
    },
    "SB6_execution_honesty": {
      "status": "confirmed",
      "note": "아트웍 원본 훼손 방지 및 저작권 보호를 위한 당사의 승인 절차와 제약(한계)을 정직하게 선공개해야 함",
      "limits_disclosed": [
        "저작권 보호를 위해 내부 직접 수정은 제한"
      ]
    },
    "SB7_authenticity_structure": {
      "status": "unknown"
    },
    "SB8_champion_arming": {
      "status": "unknown"
    },
    "SB9_protection_screening": {
      "status": "confirmed",
      "screening": "exploitative",
      "note": "구매자가 원본 아트웍의 직접적인 재해석 및 변형을 요구하여 저작권 훼손 및 카피 리스크가 명확함"
    },
    "SB10_strategic_relationship": {
      "status": "confirmed",
      "stance": "unknown",
      "note": "[정규화: stance='walk_away_values'→'unknown']"
    }
  },
  "seller_outcome": {
    "outcome": "walk_away_values",
    "rationale": "구매자는 자사 내부 디자인팀을 통한 원본 아트웍의 즉각적인 재해석 및 변형을 필수 프로세스로 요구했습니다. 이는 키뮤스튜디오의 핵심 가치인 발달장애 디자이너의 저작권 보호 및 원본 훼손 방지 원칙과 정면으로 충돌하는 착취적(exploitative) 요구이므로, 가치 충돌로 인한 관계 단절로 종결합니다."
  },
  "hypotheses": [
    {
      "frame": "exploit",
      "lens": "buy",
      "statement": "저작권 보호가 엄격한 에이전시와의 협업은 당사의 비용 절감 및 빠른 생산 사이클에 방해가 되므로, 향후 저작권 관리가 느슨하거나 매절(Buy-out)이 가능한 프리랜서 위주로 소싱 채널을 변경한다.",
      "dimension": "BB6_execution_gate"
    },
    {
      "frame": "explore",
      "lens": "sell",
      "statement": "유사한 패스트패션 및 시즌성 브랜드 접근 시, 초기 피치에서 '원본 수정 불가' 정책을 먼저 명시하여 가치 충돌이 발생할 리드를 조기 필터링해야 한다.",
      "dimension": "SB9_protection_screening",
      "evidence_needed": "초기 제안서에 라이선스 범위 및 수정 불가 정책 명시 후 리드 전환율 및 이탈 사유 데이터"
    },
    {
      "frame": "exploit",
      "lens": "sell",
      "statement": "저작권 보호 원칙을 고수하면서도 빠른 대응이 필요한 고객을 위해, 당사 프로 디자이너의 '24시간 내 수정 보장'과 같은 SLA를 패키징하여 대안으로 제시한다.",
      "dimension": "SB5_threshold_design"
    }
  ],
  "provenance": {
    "buyer_side": "simulated",
    "seller_side": "simulated",
    "outcome_anchor": false
  }
}